{
  "schema": "helix.hdoc-benchmark-raw/1",
  "plan_item": "P03-020",
  "recorded_at": "2026-07-12T08:26:27.130Z",
  "source_control": {
    "commit": "fc95bb38d08be185775f96112f7cd018096aad1b",
    "dirty": false
  },
  "environment": {
    "platform": "linux",
    "architecture": "x64",
    "os_release": "6.8.0-124-generic",
    "cpu_model": "11th Gen Intel(R) Core(TM) i5-11300H @ 3.10GHz",
    "logical_cpus": 8,
    "memory_bytes": 16503111680,
    "node": "v22.19.0",
    "rustc": "rustc 1.96.1 (31fca3adb 2026-06-26)"
  },
  "claim_boundary": {
    "timing_threshold": null,
    "decision_owner": "P03-021",
    "scope": "single-process production HDoc codec, validated warm-memory views, and an explicit dictionary byte model",
    "excludes": "storage, WAL, query planning, concurrency, cross-machine comparison, and release performance claims"
  },
  "workload": {
    "path": "benchmarks/workloads/hdoc-v1.json",
    "bytes": 1722,
    "sha256": "bff1b34e9d261512c23a04d223c71419631f4f7c3629b18bdd355e4a3d3ebceb"
  },
  "sources": [
    {
      "path": "benchmarks/workloads/hdoc-v1.json",
      "bytes": 1722,
      "sha256": "bff1b34e9d261512c23a04d223c71419631f4f7c3629b18bdd355e4a3d3ebceb"
    },
    {
      "path": "crates/helix-doc/examples/hdoc_v1_benchmark.rs",
      "bytes": 15988,
      "sha256": "0c2e32ef37fec1ec12a84d08a8f49b67e2e6a43529d215946a76ac2090076ac5"
    },
    {
      "path": "benchmarks/hdoc-contract.mjs",
      "bytes": 14316,
      "sha256": "f07026fc69eb2ef21b76f85c47f9a4ec0b8bf33ca9984c400d3d707ce252eedd"
    },
    {
      "path": "benchmarks/run-hdoc.mjs",
      "bytes": 2360,
      "sha256": "c5204d03be8133cc845b3856401c1fb5d4f09cc175ee480eaf6649e5df072f57"
    },
    {
      "path": "benchmarks/check-hdoc.mjs",
      "bytes": 1147,
      "sha256": "e866b3699ad30ab315741d706465a587da8dc38a4c438176a3d193e1f6240cfe"
    },
    {
      "path": "benchmarks/schema/hdoc-raw-v1.schema.json",
      "bytes": 7553,
      "sha256": "e85ef6b2fe4f7e6e28d22a94177e1e2d99f60f37ec7ffdf29733626851de82f6"
    },
    {
      "path": "benchmarks/schema/hdoc-summary-v1.schema.json",
      "bytes": 6550,
      "sha256": "7d815d1c209a4e74d9c0de973fad4b858baef81c027453d179a295f0d374fd82"
    }
  ],
  "engine": {
    "schema": "helix.hdoc-benchmark-engine/1",
    "warmups": 5,
    "measurements": 20,
    "iterations_per_sample": 16,
    "shape_count": 5,
    "operation_count_per_shape": 6,
    "shapes": [
      {
        "id": "minimal",
        "root_fields": 1,
        "recursive_fields": 1,
        "path_depth": 1,
        "expected_path_candidates": 1,
        "sizes": {
          "base_bytes": 336,
          "canonical_stored_bytes": 336,
          "canonical_logical_bytes": 336,
          "tagged_json_bytes": 74,
          "compressed_sections": 0
        },
        "dictionary_model": {
          "basis": "snapshot-plus-u32-path-id-per-reference",
          "path_count": 1,
          "documents": 10000,
          "snapshot_bytes": 160,
          "raw_name_reference_bytes": 30000,
          "id_reference_bytes": 40000,
          "amortized_dictionary_bytes": 40160,
          "savings_bytes": -10160,
          "savings_basis_points": -3386
        },
        "operations": [
          {
            "id": "encode_base",
            "iterations_per_sample": 16,
            "durations_ns": [
              23635,
              24454,
              20035,
              19993,
              20034,
              20077,
              20004,
              20126,
              19957,
              20021,
              20049,
              20049,
              20088,
              20001,
              19975,
              20048,
              19978,
              20021,
              20013,
              20046
            ],
            "checksum": 130000
          },
          {
            "id": "encode_canonical",
            "iterations_per_sample": 16,
            "durations_ns": [
              30257,
              30191,
              30161,
              30333,
              33050,
              33688,
              33225,
              33202,
              33149,
              33282,
              33156,
              33207,
              33249,
              33319,
              33190,
              33253,
              33185,
              33144,
              33232,
              33279
            ],
            "checksum": 130000
          },
          {
            "id": "decode_base",
            "iterations_per_sample": 16,
            "durations_ns": [
              47528,
              47368,
              47518,
              47432,
              47520,
              49119,
              45824,
              43293,
              43239,
              43336,
              43214,
              43145,
              43210,
              43220,
              43318,
              43346,
              43262,
              43199,
              43362,
              43325
            ],
            "checksum": 8000
          },
          {
            "id": "decode_canonical",
            "iterations_per_sample": 16,
            "durations_ns": [
              43235,
              43185,
              43197,
              51576,
              47226,
              47115,
              47131,
              47195,
              47169,
              47160,
              47182,
              46972,
              47281,
              47152,
              47172,
              47094,
              47052,
              47138,
              47113,
              47191
            ],
            "checksum": 8000
          },
          {
            "id": "field_lookup",
            "iterations_per_sample": 16,
            "durations_ns": [
              536,
              504,
              483,
              483,
              500,
              482,
              482,
              484,
              483,
              483,
              483,
              483,
              482,
              483,
              483,
              481,
              482,
              484,
              498,
              482
            ],
            "checksum": 1200
          },
          {
            "id": "path_lookup",
            "iterations_per_sample": 16,
            "durations_ns": [
              5072,
              4869,
              4869,
              4893,
              4875,
              4876,
              4870,
              4821,
              4837,
              4865,
              4832,
              4869,
              4847,
              4843,
              4834,
              4859,
              4846,
              4860,
              4863,
              4856
            ],
            "checksum": 1600
          }
        ]
      },
      {
        "id": "mixed_types",
        "root_fields": 12,
        "recursive_fields": 12,
        "path_depth": 1,
        "expected_path_candidates": 1,
        "sizes": {
          "base_bytes": 888,
          "canonical_stored_bytes": 888,
          "canonical_logical_bytes": 888,
          "tagged_json_bytes": 942,
          "compressed_sections": 0
        },
        "dictionary_model": {
          "basis": "snapshot-plus-u32-path-id-per-reference",
          "path_count": 12,
          "documents": 10000,
          "snapshot_bytes": 496,
          "raw_name_reference_bytes": 780000,
          "id_reference_bytes": 480000,
          "amortized_dictionary_bytes": 480496,
          "savings_bytes": 299504,
          "savings_basis_points": 3839
        },
        "operations": [
          {
            "id": "encode_base",
            "iterations_per_sample": 16,
            "durations_ns": [
              94363,
              93800,
              94011,
              93765,
              94248,
              95867,
              93743,
              93872,
              93643,
              93617,
              93516,
              93655,
              93480,
              93555,
              93152,
              93325,
              95613,
              90655,
              85236,
              85559
            ],
            "checksum": 409200
          },
          {
            "id": "encode_canonical",
            "iterations_per_sample": 16,
            "durations_ns": [
              109904,
              120627,
              120503,
              120487,
              121058,
              120927,
              120535,
              120767,
              120722,
              134427,
              111116,
              109796,
              109576,
              109508,
              109522,
              109596,
              109687,
              109528,
              115699,
              120208
            ],
            "checksum": 409200
          },
          {
            "id": "decode_base",
            "iterations_per_sample": 16,
            "durations_ns": [
              126088,
              138122,
              131175,
              126596,
              135915,
              129748,
              126509,
              126637,
              128063,
              137744,
              137022,
              126456,
              126358,
              126480,
              126495,
              126580,
              133095,
              134971,
              126251,
              126642
            ],
            "checksum": 55600
          },
          {
            "id": "decode_canonical",
            "iterations_per_sample": 16,
            "durations_ns": [
              126240,
              126339,
              126317,
              126375,
              127026,
              139864,
              129068,
              141584,
              129856,
              140083,
              139108,
              142641,
              140973,
              138795,
              146721,
              126134,
              126141,
              126149,
              126557,
              126259
            ],
            "checksum": 55600